{"schema_version":"1.0.0","diff_id":"diff-ep001","review_id":"review-ep001","scope":"project:novel_example","draft_path":"episodes/episode_001.draft.txt","final_path":"episodes/episode_001.approved.txt","draft_hash":"sha256:draft","final_hash":"sha256:final","similarity_ratio":0.9,"added_lines":2,"removed_lines":1,"classifications":["CHARACTER_STATE_DRIFT"],"root_cause_hypotheses":[{"cause":"character state was not retrieved","target":"retrieval","evidence":"context_used lacks character state","confidence":0.8},{"cause":"state existed but was omitted from the Evidence Pack","target":"state","evidence":"state file predates the draft","confidence":0.6},{"cause":"writer ignored a supplied state constraint","target":"prompt","evidence":"draft contradicts the approved state","confidence":0.5}],"completed":true,"reviewed_at":"2026-06-20T00:00:00Z"}
